{
  "task_id": "wen-kmatrix-basis-invariance",
  "claim": "The filling fraction nu = t^T K^{-1} t is invariant under K' = W^T K W and t' = W^T t for an invertible unimodular integer basis transform W.",
  "physical_premises": [
    {
      "id": "P1",
      "statement": "The state is represented by an Abelian K-matrix formalism with charge vector t.",
      "source_ref": "source:basis_transform_excerpt"
    }
  ],
  "formal_translations": [
    {
      "id": "T1",
      "physical_object": "basis relabeling of integer quasiparticle vectors",
      "formal_object": "unimodular integer matrix W with K' = W^T K W and t' = W^T t",
      "status": "given",
      "conventions": [
        "column-vector convention",
        "filling fraction computed as t^T K^{-1} t"
      ],
      "depends_on": [
        "P1"
      ]
    }
  ],
  "assumption_ledger": [
    {
      "id": "A1",
      "kind": "convention",
      "claim": "Use column vectors and the source-packet basis transform K' = W^T K W, t' = W^T t.",
      "status": "licensed",
      "support": {
        "source_type": "source_excerpt",
        "source_ref": "source:basis_transform_excerpt",
        "quote_or_summary": "The source packet defines the K-matrix filling fraction and basis transform convention."
      },
      "scope": {
        "applies_to": [
          "T1",
          "S1",
          "S2",
          "S3",
          "S4"
        ],
        "valid_when": "W is an invertible unimodular integer matrix."
      },
      "checks": [
        {
          "check_type": "source_consistency",
          "status": "pass",
          "detail": "Convention is explicitly given in the source packet."
        }
      ]
    }
  ],
  "derivation_trace": [
    {
      "id": "S1",
      "statement": "Substitute K' = W^T K W and t' = W^T t into nu' = t'^T (K')^{-1} t'.",
      "rule": "substitution",
      "depends_on": [
        "T1",
        "A1"
      ],
      "machine_expression": "nu_prime=(W.T*t).T*inverse(W.T*K*W)*(W.T*t)"
    },
    {
      "id": "S2",
      "statement": "Since W is invertible, (W^T K W)^{-1} = W^{-1} K^{-1} (W^T)^{-1}.",
      "rule": "inverse_of_transformed_K",
      "depends_on": [
        "T1"
      ],
      "machine_expression": "inverse(W.T*K*W)=inverse(W)*inverse(K)*inverse(W.T)"
    },
    {
      "id": "S3",
      "statement": "Therefore nu' = t^T W W^{-1} K^{-1} (W^T)^{-1} W^T t.",
      "rule": "matrix_associativity",
      "depends_on": [
        "S1",
        "S2"
      ]
    },
    {
      "id": "S4",
      "statement": "Cancel W W^{-1} and (W^T)^{-1} W^T to obtain nu' = t^T K^{-1} t = nu.",
      "rule": "scalar_equality",
      "depends_on": [
        "S3"
      ],
      "machine_expression": "nu_prime==t.T*inverse(K)*t"
    }
  ],
  "verification_checks": [
    {
      "id": "V1",
      "check_type": "assumption_gate",
      "status": "pass",
      "detail": "All derivation steps depend only on source facts, translations, or licensed assumptions."
    },
    {
      "id": "V2",
      "check_type": "algebra",
      "status": "pass",
      "detail": "For K=[[3,1],[1,3]], t=[1,1], W=[[1,1],[0,1]], both nu and nu_prime equal 1/2."
    }
  ],
  "final_answer": {
    "K_prime": [
      [
        3,
        4
      ],
      [
        4,
        8
      ]
    ],
    "t_prime": [
      1,
      2
    ],
    "nu": "1/2",
    "nu_prime": "1/2",
    "invariant": true
  }
}

